[
  {
    "id": "rq-001",
    "target": "Hugo Hernández Urtubia",
    "target_type": "artist",
    "territory": "los-andes",
    "province": "los-andes",
    "status": "in_progress",
    "priority": "high",
    "origin": "documento-proyecto",
    "skill": "investigar-quinta-escena-podcast",
    "notes": "Diario El Trabajo localizado y registrado como fuente propia (24 de agosto de 2026, confirma SIGPA y la función del 25 de agosto en la Escuela Mateo Cokljat). Sigue pendiente: URL propia de la ficha SIGPA (CI8699), nota de Rosa FM, y validar la ficha con la persona.",
    "added_at": "2026-09-05",
    "result": {
      "type": "artist",
      "slug": "hugo-hernandez-urtubia"
    }
  },
  {
    "id": "rq-002",
    "target": "Carlos Andrés Muñoz Rivera (Tony Pinganilla)",
    "target_type": "artist",
    "territory": "putaendo",
    "province": "san-felipe-de-aconcagua",
    "status": "in_progress",
    "priority": "high",
    "origin": "documento-proyecto",
    "skill": "investigar-quinta-escena-podcast",
    "notes": "Se intentó abrir sientevalpo.cl (404) y elmartutino.cl (403 bloqueado); ambos quedan como pistas para un próximo intento. Sigue pendiente: publicación de la Universidad de Chile sobre Festín de la Risa, resultados de Fondos de Cultura 2025 folio 749091, y validar con la persona.",
    "added_at": "2026-09-05",
    "result": {
      "type": "artist",
      "slug": "carlos-munoz-rivera"
    }
  },
  {
    "id": "rq-003",
    "target": "Nelson Hernán Rojas Torres",
    "target_type": "artist",
    "territory": "la-ligua",
    "province": "petorca",
    "status": "in_progress",
    "priority": "high",
    "origin": "documento-proyecto",
    "skill": "investigar-quinta-escena-podcast",
    "notes": "Recolectores de Memoria localizado y registrado como fuente propia (bitacoraresidencias.cultura.gob.cl, página dedicada a Nelson Rojas Torres). Sigue pendiente: nota de El Observador sobre Valle del Liwa 2024 y validar con la persona.",
    "added_at": "2026-09-05",
    "result": {
      "type": "artist",
      "slug": "nelson-rojas-torres"
    }
  },
  {
    "id": "rq-004",
    "target": "Natalia Vanessa Zúñiga Ortiz",
    "target_type": "artist",
    "territory": "quillota",
    "province": "quillota",
    "status": "in_progress",
    "priority": "high",
    "origin": "documento-proyecto",
    "skill": "investigar-quinta-escena-podcast",
    "notes": "Verificar folios 593604 y 629208 en fondosdecultura.cl; localizar Antología Enjambre y publicación municipal 2024; validar con la persona.",
    "added_at": "2026-09-05",
    "result": {
      "type": "artist",
      "slug": "natalia-zuniga-ortiz"
    }
  },
  {
    "id": "rq-005",
    "target": "Víctor Eduardo Opazo Herrera",
    "target_type": "artist",
    "territory": "villa-alemana",
    "province": "marga-marga",
    "status": "in_progress",
    "priority": "high",
    "origin": "documento-proyecto",
    "skill": "investigar-quinta-escena-podcast",
    "notes": "Confirmar rol en Compañía de Teatro Alegría; localizar fuentes municipales; validar con la persona.",
    "added_at": "2026-09-05",
    "result": {
      "type": "artist",
      "slug": "victor-opazo-herrera"
    }
  },
  {
    "id": "rq-006",
    "target": "Constanza Jesús Méndez Laínes",
    "target_type": "artist",
    "territory": "vina-del-mar",
    "province": "valparaiso",
    "status": "in_progress",
    "priority": "high",
    "origin": "documento-proyecto",
    "skill": "investigar-quinta-escena-podcast",
    "notes": "Nivel de información medio: buscar obras con Hypókritas, prensa; validar con la persona.",
    "added_at": "2026-09-05",
    "result": {
      "type": "artist",
      "slug": "constanza-mendez-laines"
    }
  },
  {
    "id": "rq-007",
    "target": "Alan Sebastián Fernández Caro",
    "target_type": "artist",
    "territory": "san-antonio",
    "province": "san-antonio",
    "status": "in_progress",
    "priority": "high",
    "origin": "documento-proyecto",
    "skill": "investigar-quinta-escena-podcast",
    "notes": "El Proa (diciembre 2021) localizado y registrado como fuente propia: confirma su rol como Pilpilén en Llo Lle We. Sigue pendiente: validación directa vía La Lancha y con la persona.",
    "added_at": "2026-09-05",
    "result": {
      "type": "artist",
      "slug": "alan-fernandez-caro"
    }
  },
  {
    "id": "rq-008",
    "target": "Compañía de Marionetas The Magic Show",
    "target_type": "company",
    "territory": "los-andes",
    "province": "los-andes",
    "status": "in_progress",
    "priority": "high",
    "origin": "documento-proyecto",
    "skill": "buscar-companias-teatro",
    "notes": "Año de inicio, redes, sitio, obras.",
    "added_at": "2026-09-05",
    "result": {
      "type": "company",
      "slug": "the-magic-show"
    }
  },
  {
    "id": "rq-009",
    "target": "Festín de la Risa",
    "target_type": "company",
    "territory": "valparaiso",
    "province": "valparaiso",
    "status": "in_progress",
    "priority": "high",
    "origin": "documento-proyecto",
    "skill": "buscar-companias-teatro",
    "notes": "Confirmar comuna de sede; sitio o redes oficiales; integrantes actuales.",
    "added_at": "2026-09-05",
    "result": {
      "type": "company",
      "slug": "festin-de-la-risa"
    }
  },
  {
    "id": "rq-010",
    "target": "Arte Escénico La Ligua",
    "target_type": "company",
    "territory": "la-ligua",
    "province": "petorca",
    "status": "in_progress",
    "priority": "high",
    "origin": "documento-proyecto",
    "skill": "buscar-companias-teatro",
    "notes": "Naturaleza jurídica, año de inicio, redes.",
    "added_at": "2026-09-05",
    "result": {
      "type": "company",
      "slug": "arte-escenico-la-ligua"
    }
  },
  {
    "id": "rq-011",
    "target": "Productora ABC: Arte, Bienestar y Cultura",
    "target_type": "company",
    "territory": "quillota",
    "province": "quillota",
    "status": "in_progress",
    "priority": "high",
    "origin": "documento-proyecto",
    "skill": "buscar-companias-teatro",
    "notes": "Año de inicio, actividad reciente, redes.",
    "added_at": "2026-09-05",
    "result": {
      "type": "company",
      "slug": "productora-abc-arte-bienestar-y-cultura"
    }
  },
  {
    "id": "rq-012",
    "target": "Compañía de Teatro Alegría",
    "target_type": "company",
    "territory": "villa-alemana",
    "province": "marga-marga",
    "status": "in_progress",
    "priority": "high",
    "origin": "documento-proyecto",
    "skill": "buscar-companias-teatro",
    "notes": "Verificar en Registro Ley 19.862 y sitio municipal.",
    "added_at": "2026-09-05",
    "result": {
      "type": "company",
      "slug": "compania-de-teatro-alegria"
    }
  },
  {
    "id": "rq-013",
    "target": "Compañía de Teatro La Lancha",
    "target_type": "company",
    "territory": "san-antonio",
    "province": "san-antonio",
    "status": "in_progress",
    "priority": "high",
    "origin": "documento-proyecto",
    "skill": "buscar-companias-teatro",
    "notes": "El Proa (diciembre 2021) localizado y registrado como fuente propia: confirma actividad de la compañía con Llo Lle We. Sigue pendiente: año de fundación, sitio y redes; validación directa (compañía responsable del proyecto).",
    "added_at": "2026-09-05",
    "result": {
      "type": "company",
      "slug": "compania-de-teatro-la-lancha"
    }
  },
  {
    "id": "rq-014",
    "target": "Llo Lle We",
    "target_type": "work",
    "territory": "san-antonio",
    "province": "san-antonio",
    "status": "in_progress",
    "priority": "medium",
    "origin": "documento-proyecto",
    "skill": "buscar-companias-teatro",
    "notes": "Créditos y funciones ya confirmados con El Proa (diciembre 2021): elenco completo, dirección de Diego Chamorro, musicalización, más de 23 funciones a esa fecha, presentada también en Lo Abarca y Santiago. Sigue pendiente: año de estreno exacto.",
    "added_at": "2026-09-05",
    "result": {
      "type": "work",
      "slug": "llo-lle-we"
    }
  },
  {
    "id": "rq-015",
    "target": "El Loco y la Triste (Teatro Alegría)",
    "target_type": "work",
    "territory": "villa-alemana",
    "province": "marga-marga",
    "status": "in_progress",
    "priority": "medium",
    "origin": "documento-proyecto",
    "skill": "buscar-companias-teatro",
    "notes": "Confirmar créditos, año de estreno y funciones.",
    "added_at": "2026-09-05",
    "result": {
      "type": "work",
      "slug": "el-loco-y-la-triste"
    }
  },
  {
    "id": "rq-016",
    "target": "Ayayai (Festín de la Risa)",
    "target_type": "work",
    "territory": "valparaiso",
    "province": "valparaiso",
    "status": "in_progress",
    "priority": "medium",
    "origin": "documento-proyecto",
    "skill": "buscar-companias-teatro",
    "notes": "Confirmar créditos, año de estreno y funciones.",
    "added_at": "2026-09-05",
    "result": {
      "type": "work",
      "slug": "ayayai"
    }
  },
  {
    "id": "rq-017",
    "target": "Varieté de Marionetas Musicales (The Magic Show)",
    "target_type": "work",
    "territory": "los-andes",
    "province": "los-andes",
    "status": "in_progress",
    "priority": "medium",
    "origin": "documento-proyecto",
    "skill": "buscar-companias-teatro",
    "notes": "Confirmar créditos, año de estreno y funciones.",
    "added_at": "2026-09-05",
    "result": {
      "type": "work",
      "slug": "variete-de-marionetas-musicales"
    }
  },
  {
    "id": "rq-018",
    "target": "La Barconeta",
    "target_type": "company",
    "territory": "valparaiso",
    "province": "valparaiso",
    "status": "pending",
    "priority": "high",
    "origin": "catalogo-oficial",
    "skill": "buscar-companias-teatro",
    "notes": "Aparece en el Catálogo de Compañías de Teatro Tradicional de Títeres Región de Valparaíso (Servicio Nacional del Patrimonio Cultural, 2025). Confirmar comuna y actividad. Marionetas de hilos, itinerante, funciones a bordo de una lancha; fundada en 2016.",